{
  "schema": "motion-brief/v1",
  "id": "example-linkedin-stat-post",
  "createdAt": "2026-10-10T00:00:00.000Z",
  "audience": "HR and people leaders",
  "purpose": "Make the case for flexible hours with one memorable number",
  "whereItPlays": "LinkedIn feed, square, autoplays muted",
  "platform": "linkedin-1x1",
  "canvas": {
    "width": 1080,
    "height": 1080,
    "fps": 30
  },
  "safeZone": {
    "top": 54,
    "right": 54,
    "bottom": 54,
    "left": 54
  },
  "durationSec": 13.5,
  "theme": {
    "palette": {
      "background": "#ffffff",
      "surface": "#f1f5f9",
      "primary": "#2563eb",
      "accent": "#047857",
      "text": "#0f172a",
      "mutedText": "#475569"
    },
    "fonts": {
      "heading": "Plus Jakarta Sans",
      "body": "Inter"
    },
    "motionStyle": "calm",
    "cornerRadius": 16
  },
  "hook": "Get \"73%\" on screen within 0.5 s with a bold calm entrance and keep it moving through 1.5 s.",
  "scenes": [
    {
      "id": "s1",
      "type": "stat",
      "goal": "Make one number land",
      "durationSec": 4,
      "onScreenText": [
        {
          "role": "stat",
          "text": "73%",
          "maxChars": 12
        },
        {
          "role": "label",
          "text": "want flexible hours",
          "maxChars": 32
        },
        {
          "role": "body",
          "text": "Sample survey of 2,000 employees",
          "maxChars": 120
        }
      ],
      "icons": [],
      "images": [],
      "transitionIn": "cut"
    },
    {
      "id": "s2",
      "type": "chart",
      "goal": "Show a trend or comparison in data",
      "durationSec": 6,
      "onScreenText": [
        {
          "role": "headline",
          "text": "Flexibility vs retention",
          "maxChars": 48
        },
        {
          "role": "label",
          "text": "Flexible teams: 12% turnover",
          "maxChars": 32
        },
        {
          "role": "label",
          "text": "Fixed hours: 21% turnover",
          "maxChars": 32
        }
      ],
      "icons": [],
      "images": [],
      "transitionIn": "fade"
    },
    {
      "id": "s3",
      "type": "cta",
      "goal": "Tell viewers what to do next",
      "durationSec": 3.5,
      "onScreenText": [
        {
          "role": "headline",
          "text": "Read the full report",
          "maxChars": 48
        },
        {
          "role": "cta",
          "text": "Link in comments",
          "maxChars": 32
        }
      ],
      "icons": [],
      "images": [],
      "transitionIn": "fade"
    }
  ],
  "voiceover": {
    "enabled": false,
    "voice": "default",
    "language": "en-US",
    "wordsPerMinute": 150,
    "pronunciations": {}
  },
  "captions": {
    "enabled": false,
    "style": "line",
    "maxLines": 2
  },
  "music": {
    "enabled": false,
    "note": ""
  },
  "rules": {
    "minContrast": 4.5,
    "minFontPctOfHeight": 3.5,
    "readingWordsPerSec": 3,
    "maxTextLinesPerBlock": 3
  },
  "estimate": {
    "tier": "light",
    "scenes": 3,
    "durationSec": 13.5,
    "complexityNotes": [
      "3 scenes over 13.5 s",
      "1 chart scene"
    ],
    "voCharacters": 0
  },
  "hash": "1796254bb89f883e198313f459212c95a82564c2e5afeebfd9f45fa2145c22ae"
}
